Input_Text,Process_Text,Status,Before Replace,After Replace
1995 থেকে 2014 শতাব্দীর বাংলাদেশ আর মানুষ বুজতে শুরু করে,উনিশশো পঁচানব্বই থেকে দুই হাজার চৌদ্দ শতাব্দীর বাংলাদেশ আর মানুষ বুজতে শুরু করে,False,"['1995', '2014']","['উনিশশো পঁচানব্বই', 'দুই হাজার চৌদ্দ']"
1234 হতে  ২০১৪ সালে বাংলাদেশ আর মানুষ বুজতে শুরু করে,বারোশো চৌত্রিশ হতে দুই হাজার চৌদ্দ সালে বাংলাদেশ আর মানুষ বুজতে শুরু করে,False,"['1234', '২০১৪']","['বারোশো চৌত্রিশ', 'দুই হাজার চৌদ্দ']"
2023 চেয়ে 2014সালে বাংলাদেশ আর মানুষ বুজতে শুরু ক,দুই হাজার তেইশ চেয়ে দুই হাজার চৌদ্দসালে বাংলাদেশ আর মানুষ বুজতে শুরু ক,False,"['2023', '2014সালে']","['দুই হাজার তেইশ', 'দুই হাজার চৌদ্দসালে']"
১৯৫৪ থেকে ২০১৪ সালে বাংলাদেশ আর মানুষ বুজতে শুরু করে,উনিশশো চুয়ান্ন থেকে দুই হাজার চৌদ্দ সালে বাংলাদেশ আর মানুষ বুজতে শুরু করে,False,"['১৯৫৪', '২০১৪']","['উনিশশো চুয়ান্ন', 'দুই হাজার চৌদ্দ']"
1234 হতে  ২০১৪ শতাব্দীর বাংলাদেশ আর মানুষ বুজতে শুরু করে,বারোশো চৌত্রিশ হতে দুই হাজার চৌদ্দ শতাব্দীর বাংলাদেশ আর মানুষ বুজতে শুরু করে,False,"['1234', '২০১৪']","['বারোশো চৌত্রিশ', 'দুই হাজার চৌদ্দ']"
২০২৩ চেয়ে  ২০১৪ সালের বাংলাদেশ আর মানুষ বুজতে শুরু ক,দুই হাজার তেইশ চেয়ে দুই হাজার চৌদ্দ সালের বাংলাদেশ আর মানুষ বুজতে শুরু ক,False,"['২০২৩', '২০১৪']","['দুই হাজার তেইশ', 'দুই হাজার চৌদ্দ']"
1995 থেকে 2014 শতাব্দীর বাংলাদেশ আর মানুষ বুজতে শুরু করে,উনিশশো পঁচানব্বই থেকে দুই হাজার চৌদ্দ শতাব্দীর বাংলাদেশ আর মানুষ বুজতে শুরু করে,False,"['1995', '2014']","['উনিশশো পঁচানব্বই', 'দুই হাজার চৌদ্দ']"
1234 হতে  ২০১৪ শতাব্দীতে বাংলাদেশ আর মানুষ বুজতে শুরু করে,বারোশো চৌত্রিশ হতে দুই হাজার চৌদ্দ শতাব্দীতে বাংলাদেশ আর মানুষ বুজতে শুরু করে,False,"['1234', '২০১৪']","['বারোশো চৌত্রিশ', 'দুই হাজার চৌদ্দ']"
2023 চেয়ে 2014সাল বাংলাদেশ আর মানুষ বুজতে শুরু ক,দুই হাজার তেইশ চেয়ে দুই হাজার চৌদ্দসাল বাংলাদেশ আর মানুষ বুজতে শুরু ক,False,"['2023', '2014সাল']","['দুই হাজার তেইশ', 'দুই হাজার চৌদ্দসাল']"
2023 চেয়ে 2014 খ্রিস্টাব্দ বাংলাদেশ আর মানুষ বুজতে শুরু ক,দুই হাজার তেইশ চেয়ে দুই হাজার চৌদ্দ খ্রিস্টাব্দ বাংলাদেশ আর মানুষ বুজতে শুরু ক,False,"['2023', '2014']","['দুই হাজার তেইশ', 'দুই হাজার চৌদ্দ']"
2023 চেয়ে 2014 খ্রিস্টাব্দের বাংলাদেশ আর মানুষ বুজতে শুরু ক,দুই হাজার তেইশ চেয়ে দুই হাজার চৌদ্দ খ্রিস্টাব্দের বাংলাদেশ আর মানুষ বুজতে শুরু ক,False,"['2023', '2014']","['দুই হাজার তেইশ', 'দুই হাজার চৌদ্দ']"
2023 চেয়ে 2014 খ্রিস্টাব্দ বাংলাদেশ আর মানুষ বুজতে শুরু ক,দুই হাজার তেইশ চেয়ে দুই হাজার চৌদ্দ খ্রিস্টাব্দ বাংলাদেশ আর মানুষ বুজতে শুরু ক,False,"['2023', '2014']","['দুই হাজার তেইশ', 'দুই হাজার চৌদ্দ']"
2023 চেয়ে 2014 খ্রিস্টপূর্বাব্দের বাংলাদেশ আর মানুষ বুজতে শুরু ক,দুই হাজার তেইশ চেয়ে দুই হাজার চৌদ্দ খ্রিস্টপূর্বাব্দের বাংলাদেশ আর মানুষ বুজতে শুরু ক,False,"['2023', '2014']","['দুই হাজার তেইশ', 'দুই হাজার চৌদ্দ']"
2023 চেয়ে 1115 বাংলাদেশ আর মানুষ বুজতে শুরু ক ২০২৩ চেয়ে  ২০১৪ সালে আর মানুষ বুজতে শুরু ২০২৩ চেয়ে 2025 সালে, টু থাউজ্যান্ড টোয়েন্টি-থ্রি চেয়ে ওয়ান থাউজ্যান্ড ওয়ান হান্ড্রেড ফিফটিন বাংলাদেশ আর মানুষ বুজতে শুরু ক দুই হাজার তেইশ চেয়ে দুই হাজার চৌদ্দ সালে আর মানুষ বুজতে শুরু দুই হাজার তেইশ চেয়ে দুই হাজার পঁচিশ সালে,False,"['2023', '1115', '২০২৩', '২০১৪', '২০২৩', '2025']","['টু থাউজ্যান্ড টোয়েন্টি-থ্রি', 'ওয়ান থাউজ্যান্ড ওয়ান হান্ড্রেড ফিফটিন', 'দুই হাজার তেইশ', 'দুই হাজার চৌদ্দ', 'দুই হাজার তেইশ', 'দুই হাজার পঁচিশ']"
২০১২সাল,দুই হাজার বারো সাল,False,['২০১২সাল'],['দুই হাজার বারো সাল']
1994সাল,উনিশশো চুরানব্বই সাল,False,['1994সাল'],['উনিশশো চুরানব্বই সাল']
"09612345678 ডিজিটাল  1 6 2 2 2 রেজিস্ট্রেশন০৯৬১২৩৪৫৬৭৮, ডিজিটাল রেজিস্ট্রেশন ০৯৬১০-০১০৬১৬ 09610-010616 সার্টিফিকেট সংক্রান্ত 01790540211124562 যোগাযোগ করতে হলে01790-540211অথবা 01790-541111 নম্বরে যোগাযোগ করতে হবে 01790540211, +8801790540211, ০১৭৯০৫৪০২১১, +৮৮০১৭৯০৫৪০২১১","জিরো নাইন সিক্স ওয়ান টু থ্রি ফোর ফাইভ সিক্স সেভেন এইট ডিজিটাল ওয়ান সিক্স টু টু টু রেজিস্ট্রেশন জিরো নাইন সিক্স ওয়ান টু থ্রি ফোর ফাইভ সিক্স সেভেন এইট, ডিজিটাল রেজিস্ট্রেশন জিরো নাইন সিক্স ওয়ান ডাবল জিরো ওয়ান জিরো সিক্স ওয়ান সিক্স জিরো নাইন সিক্স ওয়ান ডাবল জিরো ওয়ান জিরো সিক্স ওয়ান সিক্স সার্টিফিকেট সংক্রান্ত জিরো ওয়ান সেভেন নাইন জিরো ফাইভ ফোর জিরো টু ডাবল ওয়ান ওয়ান লাখ টোয়েন্টি-ফোর থাউজ্যান্ড ফাইভ হান্ড্রেড সিক্সটি-টু যোগাযোগ করতে হলে জিরো ওয়ান সেভেন নাইন জিরো ফাইভ ফোর জিরো টু ডাবল ওয়ান অথবা জিরো ওয়ান সেভেন নাইন জিরো ফাইভ ফোর ট্রিপল ওয়ান ওয়ান নম্বরে যোগাযোগ করতে হবে জিরো ওয়ান সেভেন নাইন জিরো ফাইভ ফোর জিরো টু ডাবল ওয়ান, প্লাস ডাবল এইট জিরো ওয়ান সেভেন নাইন জিরো ফাইভ ফোর জিরো টু ডাবল ওয়ান, জিরো ওয়ান সেভেন নাইন জিরো ফাইভ ফোর জিরো টু ডাবল ওয়ান, প্লাস ডাবল এইট জিরো ওয়ান সেভেন নাইন জিরো ফাইভ ফোর জিরো টু ডাবল ওয়ান",False,"['09612345678', '1 6 2 2 2 রেজিস্ট্রেশন০৯৬১২৩৪৫৬৭৮,', '০৯৬১০-০১০৬১৬ 09610-010616', '01790540211124562', 'হলে01790-540211অথবা 01790-541111', '01790540211, +8801790540211, ০১৭৯০৫৪০২১১, +৮৮০১৭৯০৫৪০২১১']","['জিরো নাইন সিক্স ওয়ান টু থ্রি ফোর ফাইভ সিক্স সেভেন এইট', 'ওয়ান সিক্স টু টু টু রেজিস্ট্রেশন জিরো নাইন সিক্স ওয়ান টু থ্রি ফোর ফাইভ সিক্স সেভেন এইট,', 'জিরো নাইন সিক্স ওয়ান ডাবল জিরো ওয়ান জিরো সিক্স ওয়ান সিক্স জিরো নাইন সিক্স ওয়ান ডাবল জিরো ওয়ান জিরো সিক্স ওয়ান সিক্স', 'জিরো ওয়ান সেভেন নাইন জিরো ফাইভ ফোর জিরো টু ডাবল ওয়ান ওয়ান লাখ টোয়েন্টি-ফোর থাউজ্যান্ড ফাইভ হান্ড্রেড সিক্সটি-টু', 'হলে জিরো ওয়ান সেভেন নাইন জিরো ফাইভ ফোর জিরো টু ডাবল ওয়ান অথবা জিরো ওয়ান সেভেন নাইন জিরো ফাইভ ফোর ট্রিপল ওয়ান ওয়ান', 'জিরো ওয়ান সেভেন নাইন জিরো ফাইভ ফোর জিরো টু ডাবল ওয়ান, প্লাস ডাবল এইট জিরো ওয়ান সেভেন নাইন জিরো ফাইভ ফোর জিরো টু ডাবল ওয়ান, জিরো ওয়ান সেভেন নাইন জিরো ফাইভ ফোর জিরো টু ডাবল ওয়ান, প্লাস ডাবল এইট জিরো ওয়ান সেভেন নাইন জিরো ফাইভ ফোর জিরো টু ডাবল ওয়ান']"
যোগাযোগ করতে হলে01790540211অথবা,যোগাযোগ করতে হলে জিরো ওয়ান সেভেন নাইন জিরো ফাইভ ফোর জিরো টু ডাবল ওয়ান অথবা,False,['হলে01790540211অথবা'],['হলে জিরো ওয়ান সেভেন নাইন জিরো ফাইভ ফোর জিরো টু ডাবল ওয়ান অথবা']
যোগাযোগ করতে হলে01790-540211অথবা,যোগাযোগ করতে হলে জিরো ওয়ান সেভেন নাইন জিরো ফাইভ ফোর জিরো টু ডাবল ওয়ান অথবা,False,['হলে01790-540211অথবা'],['হলে জিরো ওয়ান সেভেন নাইন জিরো ফাইভ ফোর জিরো টু ডাবল ওয়ান অথবা']
"জরুরী বিতরণে ফি ৮,৬২৫.৬২৫ টাকা",জরুরী বিতরণে ফি আট হাজার ছয়শো পঁচিশ দশমিক ছয় দুই পাঁচ টাকা,False,"['৮,৬২৫.৬২৫']",['আট হাজার ছয়শো পঁচিশ দশমিক ছয় দুই পাঁচ']
দাঃবাঃ আমাদের প্রধান অতিথি,দামাত বারাকাতুল্লাহ আমাদের প্রধান অতিথি,False,['দাঃবাঃ'],['দামাত বারাকাতুল্লাহ']
মোসা: রুবিনা ভালো রান্না করেন,মোছাম্মত রুবিনা ভালো রান্না করেন,False,['মোসা:'],['মোছাম্মত']
রাশিয়ায় ₽৭০০ ব্যয় করেছি,রাশিয়ায় সাতশো রুবেল ব্যয় করেছি,False,['₽৭০০'],['সাতশো রুবেল']
আমার কাছে £৫০০ এবং €৩০০ আছে,আমার কাছে পাঁচশো পাউন্ড এবং তিনশো ইউরো আছে,False,"['£৫০০', '€৩০০']","['পাঁচশো পাউন্ড', 'তিনশো ইউরো']"
"আমি ৳১০,০০০ ব্যয় করেছি""","আমি দশ হাজার টাকা ব্যয় করেছি""",False,"['৳১০,০০০']",['দশ হাজার টাকা']
আ: রহমান আমাদের বন্ধু,আব্দুর রহমান আমাদের বন্ধু,False,['আ:'],['আব্দুর']
মোসাঃ রুবিনা ভালো রান্না করেন,মোসাম্মত রুবিনা ভালো রান্না করেন,False,['মোসাঃ'],['মোসাম্মত']
শাইখ দাঃবাঃ আমাদের মসজিদে আসবেন,শাইখ দামাত বারাকাতুল্লাহ আমাদের মসজিদে আসবেন,False,['দাঃবাঃ'],['দামাত বারাকাতুল্লাহ']
আমার দাদা মোসাঃ খাতুন খুব ভালো মানুষ ছিলেন,আমার দাদা মোসাম্মত খাতুন খুব ভালো মানুষ ছিলেন,False,['মোসাঃ'],['মোসাম্মত']
দাঃবাঃ আমাদের প্রধান অতিথি,দামাত বারাকাতুল্লাহ আমাদের প্রধান অতিথি,False,['দাঃবাঃ'],['দামাত বারাকাতুল্লাহ']
আ: রহমান আমাদের বন্ধু,আব্দুর রহমান আমাদের বন্ধু,False,['আ:'],['আব্দুর']
মো: রিয়াদ ভালো ছাত্র,মোহাম্মদ রিয়াদ ভালো ছাত্র,False,['মো:'],['মোহাম্মদ']
আজকের তাপমাত্রা ৪৪°F,আজকের তাপমাত্রা চুয়াল্লিশ ডিগ্রী ফারেনহাইট,False,['৪৪°F'],['চুয়াল্লিশ ডিগ্রী ফারেনহাইট']
আজকের তাপমাত্রা৪৪°F,আজকের তাপমাত্রা চুয়াল্লিশ ডিগ্রী ফারেনহাইট,False,['তাপমাত্রা৪৪°F'],['তাপমাত্রা চুয়াল্লিশ ডিগ্রী ফারেনহাইট']
মো: কাশেম একজন সফল ব্যবসায়ী,মোহাম্মদ কাশেম একজন সফল ব্যবসায়ী,False,['মো:'],['মোহাম্মদ']
"তিনি পঞ্চাশ পারসেন্ট ছাড় পাচ্ছেন আজকের অফারে।""","তিনি পঞ্চাশ পারসেন্ট ছাড় পাচ্ছেন আজকের অফারে। """,False,"['অফারে।""']","['অফারে। ""']"
আমার কাছে £৫০০ এবং €৩০০ আছে,আমার কাছে পাঁচশো পাউন্ড এবং তিনশো ইউরো আছে,False,"['£৫০০', '€৩০০']","['পাঁচশো পাউন্ড', 'তিনশো ইউরো']"
এই বিলটি ₽৫০০০ এর,এই বিলটি পাঁচ হাজার রুবেল এর,False,['₽৫০০০'],['পাঁচ হাজার রুবেল']
এই বিলটি ₽5000 এর,এই বিলটি পাঁচ হাজার রুবেল এর,False,['₽5000'],['পাঁচ হাজার রুবেল']
রাশিয়ায় ₽৭০০ ব্যয় করেছি,রাশিয়ায় সাতশো রুবেল ব্যয় করেছি,False,['₽৭০০'],['সাতশো রুবেল']
"রাশিয়ায় ₽5000 ব্যয় করেছি""","রাশিয়ায় পাঁচ হাজার রুবেল ব্যয় করেছি""",False,['₽5000'],['পাঁচ হাজার রুবেল']
এই পণ্যটির মূল্য $25.50 লাখ,"এই পণ্যটির মূল্য টোয়েন্টি-ফাইভ পয়েন্ট ফাইভ জিরো লাখ ডলার, ",False,['$25.50'],"['টোয়েন্টি-ফাইভ পয়েন্ট ফাইভ জিরো', 'ডলার,']"
আমার কাছে ৳৫০০ আছে,আমার কাছে পাঁচশো টাকা আছে,False,['৳৫০০'],['পাঁচশো টাকা']
সে £১০০ ধার নিয়েছে,সে একশো পাউন্ড ধার নিয়েছে,False,['£১০০'],['একশো পাউন্ড']
রাশিয়ায় ₽৭০০ ব্যয় করেছি,রাশিয়ায় সাতশো রুবেল ব্যয় করেছি,False,['₽৭০০'],['সাতশো রুবেল']
তুরস্কে ₺৩০০ দিয়ে কেনাকাটা করলাম,তুরস্কে তিনশো লিরা দিয়ে কেনাকাটা করলাম,False,['₺৩০০'],['তিনশো লিরা']
"আমি ৳১০,০০০ ব্যয় করেছি",আমি দশ হাজার টাকা ব্যয় করেছি,False,"['৳১০,০০০']",['দশ হাজার টাকা']
"ব্যাংকে ₹২৫,০০০ জমা দিয়েছি",ব্যাংকে পঁচিশ হাজার রুপি জমা দিয়েছি,False,"['₹২৫,০০০']",['পঁচিশ হাজার রুপি']
তিনি ₹১০ লাখ দান করেছেন,"তিনি দশ লাখ রুপি, দান করেছেন",False,['₹১০'],"['দশ', 'রুপি,']"
দোকানে ¥১৫০০ খরচ করলাম,দোকানে এক হাজার পাঁচশো ইয়েন খরচ করলাম,False,['¥১৫০০'],['এক হাজার পাঁচশো ইয়েন']
সে ₺৭৫০ দিয়ে পোশাক কিনেছে,সে সাতশো পঞ্চাশ লিরা দিয়ে পোশাক কিনেছে,False,['₺৭৫০'],['সাতশো পঞ্চাশ লিরা']
"আমাদের কোম্পানি ৳৫,০০,০০০ বিনিয়োগ করেছে",আমাদের কোম্পানি পাঁচ লক্ষ টাকা বিনিয়োগ করেছে,False,"['৳৫,০০,০০০']",['পাঁচ লক্ষ টাকা']
"এই বইটির মূল্য $15""","এই বইটির মূল্য পনেরো ডলার """,False,"['$15""']","['পনেরো ডলার ""']"
আমার উচ্চতা ১৭০ সেমি,আমার উচ্চতা একশো সত্তর সেন্টিমিটার,False,['১৭০ সেমি'],['একশো সত্তর সেন্টিমিটার']
"প্রদর্শনীটি চলার কথা ছিল ১২ মে পর্যন্ত, তবে দর্শকদের ব্যাপক আগ্রহের কারণে তিন দিন সময় বাড়িয়ে ১৫ মে পর্যন্ত করা হয়েছিল ১৫.১৫","প্রদর্শনীটি চলার কথা ছিল বারো মে পর্যন্ত, তবে দর্শকদের ব্যাপক আগ্রহের কারণে তিন দিন সময় বাড়িয়ে পনেরো মে পর্যন্ত করা হয়েছিল পনেরো দশমিক এক পাঁচ ",False,"['১২', '১৫', '১৫.১৫']","['বারো', 'পনেরো', 'পনেরো দশমিক এক পাঁচ']"
"এটা.. খুব.. জরুরি!!""","এটা . খুব . জরুরি! """,False,"['এটা..', 'খুব..', 'জরুরি!!""']","['এটা .', 'খুব .', 'জরুরি! ""']"
তারা একসাথে আছে...,তারা একসাথে আছে . ,False,['আছে...'],['আছে .']
আমি পড়তে ভালোবাসি...,আমি পড়তে ভালোবাসি . ,False,['ভালোবাসি...'],['ভালোবাসি .']
সেখানে একটি বাড়ি আছে...,সেখানে একটি বাড়ি আছে . ,False,['আছে...'],['আছে .']
আমি এটা পছন্দ করি না...,আমি এটা পছন্দ করি না . ,False,['না...'],['না .']
আমি খুব খুশি!!!,আমি খুব খুশি!,False,['খুশি!!!'],['খুশি!']
এটি একটি #টেকনোলজি কনফারেন্স।,এটি একটি হ্যাশ টেকনোলজি কনফারেন্স।,False,['#টেকনোলজি'],"['হ্যাশ', 'টেকনোলজি']"
"দয়া !@করে #পবিত্র &)কুরআনুল *কারিম বলেন,,,,পবিত্র কথাটা অবশ্যই বলবেন,,, প্লিজ","দয়া! এট দা রেট করে হ্যাশ পবিত্র এন্ড )কুরআনুল *কারিম বলেন, পবিত্র কথাটা অবশ্যই বলবেন, প্লিজ",False,"['দয়া', '!@করে', '#পবিত্র', '&)কুরআনুল', 'বলেন,,,,পবিত্র', 'বলবেন,,,']","['দয়া!', 'এট দা রেট', 'করে হ্যাশ', 'পবিত্র এন্ড', ')কুরআনুল', 'বলেন, পবিত্র', 'বলবেন,']"
"মার্চ ২৫, 1996 তারিখের কনসার্ট টিকেটগুলি দ্রুত বিক্রয় হচ্ছে",মার্চ পঁচিশ উনিশশো ছিয়ানব্বই তারিখের কনসার্ট টিকেটগুলি দ্রুত বিক্রয় হচ্ছে,False,"['২৫, 1996']",['পঁচিশ উনিশশো ছিয়ানব্বই']
মার্চ ২৫% তারিখের কনসার্ট টিকেটগুলি দ্রুত বিক্রয় হচ্ছে,মার্চ পঁচিশ পারসেন্ট তারিখের কনসার্ট টিকেটগুলি দ্রুত বিক্রয় হচ্ছে,False,['২৫%'],['পঁচিশ পারসেন্ট']
র‍্যাব,র‍্যাব,True,[],[]
বাংলা​,বাংলা​,True,[],[]
র‍্য,র‍্য,True,[],[]
